Rating,Review,Brand,NoStopW Tokens,Lemmatized Tokens,TB Polarity Score,TB Sentiment
1,"i'm having to return this. it sure is gentle - too gentle. i wear a light ""bb"" coverage/tinted moisturizer. at the end of the day - its usually gone off my face anyway. i washed my face 3x with this cleanser - letting it stay on my skin to kind of ""soak"". at the end, i ran a cotton ball dipped in clinque toner - and sure enough - beige bb cream residue was on the cotton ball. it doesn't clean my skin at all. even when i didn't wear makeup - i still felt icky.i have dry to very dry skin.i got a sample of origins foamy face wash - and i swear by it now. that gets my face cleaaaaaaan and feels good massaging it in. i just have to put on a good moisturizer after using.will not clean anything off my face.",CeraVe,"['return', 'gentle', 'gentle', 'light', 'coveragetinted', 'washed', 'letting', 'stay', 'soak', 'cotton', 'ball', 'dipped', 'clinque', 'toner', 'beige', 'residue', 'cotton', 'ball', 'nt', 'clean', 'nt', 'icky i', 'skin i', 'sample', 'origins', 'foamy', 'swear', 'cleaaaaaaan', 'feels', 'massaging', 'using will', 'not', 'clean']",return gentle gentle light coveragetinted washed letting stay soak cotton ball dipped clinque toner beige residue cotton ball nt clean nt icky i skin i sample origin foamy swear cleaaaaaaan feel massaging using will not clean,0.11388888888888889,positive
1,"the media could not be loaded.
                



 didn’t work for me, gave me bumps lots of themdried out my face",CeraVe,"['media', 'not', 'loaded', 'bumps', 'lots', 'themdried']",medium not loaded bump lot themdried,0.0,neutral
1,"this burns my face and leaves day long red patches.  it's okay for my body but, that's not what i bought it for.i think i must be allergic to this product.",CeraVe,"['burns', 'leaves', 'red', 'patches', 'not', 'for i', 'allergic']",burn leaf red patch not for i allergic,0.0,neutral
1,there’s no way this is actually a cleanser. it looks and feels just like lotion and does not remove any dirt or makeup off my face. i have to go back over with micellar water to actually clean my face. i would stay away from this one!!lotion packaged in a cleaner bottle,CeraVe,"['feels', 'not', 'remove', 'dirt', 'micellar', 'water', 'clean', 'stay', 'packaged', 'cleaner']",feel not remove dirt micellar water clean stay packaged cleaner,0.3666666666666667,positive
1,"this product is, unfortunately, nearly unusable due to the extremely watery texture. i can barely get my hands up to my face without all of it running off between my fingers and over the sides of my palms. i believe i received a faulty product, because i know the texture should be thicker than this. i am pregnant and don't feel safe going to the post office to mail the product back. i am hoping for a replacement so i can use this face wash normally! there was no way to contact the seller so i am leaving this review and hoping they reach out to me.received faulty product - extremely watery texture",CeraVe,"['unusable', 'extremely', 'watery', 'barely', 'hands', 'running', 'fingers', 'palms', 'received', 'faulty', 'thicker', 'pregnant', 'nt', 'safe', 'post', 'office', 'mail', 'hoping', 'contact', 'seller', 'leaving', 'hoping', 'reach', 'me received', 'faulty', 'extremely', 'watery']",unusable extremely watery barely hand running finger palm received faulty thicker pregnant nt safe post office mail hoping contact seller leaving hoping reach me received faulty extremely watery,0.12666666666666665,positive
1,i have mild rosacea and very dry sensitive skin. everything i saw online recommended this product in general but especially for people with sensitive skin. it made my face burn and turn slightly red! it was not a tingle or temporary burn…it just kept being hot until i washed it off. i’m sure it is a great product but sensitive skin folks beware!not for sensitive skin,CeraVe,"['mild', 'rosacea', 'online', 'recommended', 'burn', 'red', 'not', 'tingle', 'temporary', 'burnit', 'hot', 'washed', 'folks', 'beware', 'not']",mild rosacea online recommended burn red not tingle temporary burnit hot washed folk beware not,0.19444444444444442,positive
1,the foaming cleanser works better. this one irritates my face and makes my skin redmy skin does not like it,CeraVe,"['irritates', 'redmy', 'not']",irritates redmy not,0.0,neutral
1,i broke out in a rash. my dermatologist who recommended product told me to stop. he did a patch test on me.  the test came back i was allergic to paraben mix.amazon needs to stop selling these products with cancer causing ingredients.please don't buy any of cerave products. all products have paraben mix.google paraben mix.paraben mix ingredient,CeraVe,"['broke', 'rash', 'recommended', 'told', 'patch', 'allergic', 'paraben', 'mix amazon', 'selling', 'products', 'cancer', 'causing', 'ingredients please', 'nt', 'products', 'products', 'paraben', 'mix google', 'paraben', 'mix paraben', 'mix']",broke rash recommended told patch allergic paraben mix amazon selling product cancer causing ingredients please nt product product paraben mix google paraben mix paraben mix,0.0,neutral
1,"the product itself is good. that being said, providing a tamper- resistant, sealed label is a no-brainer.unsealed personal care items should be sealed.",CeraVe,"['providing', 'tamper', 'resistant', 'sealed', 'label', 'nobrainer unsealed', 'personal', 'items', 'sealed']",providing tamper resistant sealed label nobrainer unsealed personal item sealed,0.0,neutral
1,"the sole purpose of me buying this was for makeup and oil removal without stripping my skin of moisture. it actually doesn’t strip anything not even what it’s supposed to strip away. makeup was still left on my face even after washing it twice with this cleanser. this would be good for someone that doesn’t wear makeup, but i would still not recommend using it then because it seems like it will leave buildup on your face with time. that will then cause allergies in the long run. might be better just to pick another cleanser that actually cleans instead of sitting on your face like a moisturizer.does not clean. makeup still in place.",CeraVe,"['sole', 'purpose', 'buying', 'removal', 'stripping', 'strip', 'not', 'supposed', 'strip', 'left', 'washing', 'not', 'recommend', 'buildup', 'allergies', 'pick', 'cleans', 'sitting', 'moisturizer does', 'not', 'clean']",sole purpose buying removal stripping strip not supposed strip left washing not recommend buildup allergy pick clean sitting moisturizer does not clean,0.04583333333333334,positive
1,"my eczema symptoms developed on my body, so i wanted to prevent anything happening on my face.purchased this item due to highly rated reviews and wonderful reviews.this item felt like i am washing my face with a lotion or moisturizer. some people may find it as moisturizing, but i felt like my face wasn't fully washed even after multiple rounds of wash.i purchased bioderm wash for face & body and i love them. it foams and feels very clean after the wash.unfortunately i don't like this item",CeraVe,"['eczema', 'symptoms', 'developed', 'prevent', 'happening', 'face purchased', 'item', 'highly', 'rated', 'reviews', 'wonderful', 'reviews this', 'item', 'washing', 'nt', 'washed', 'multiple', 'rounds', 'wash i', 'bioderm', 'love', 'foams', 'feels', 'clean', 'wash unfortunately', 'nt', 'item']",eczema symptom developed prevent happening face purchased item highly rated review wonderful reviews this item washing nt washed multiple round wash i bioderm love foam feel clean wash unfortunately nt item,0.17833333333333334,positive
2,"all other create products ive purchased similar to this one had protective plastic around the top to help prevent it from being used without paying. this one came without the plastic around the cap and seemed like someone had used it already. it also had some stains on the front.did not have protective plastic to prevent opening, seemed used",CeraVe,"['create', 'products', 'protective', 'plastic', 'prevent', 'paying', 'plastic', 'cap', 'stains', 'front did', 'not', 'protective', 'plastic', 'prevent']",create product protective plastic prevent paying plastic cap stain front did not protective plastic prevent,0.0,neutral
2,"they put peg in this. one of the many chemicals banned in the eu in products for a reason. big chemical companies win here. given cereve’s reputation, i didn’t even think to check. i would have hoped this company would not add these chemicals. lesson learned.contains peg",CeraVe,"['peg', 'chemicals', 'banned', 'eu', 'products', 'reason', 'chemical', 'companies', 'win', 'cereve', 'reputation', 'check', 'hoped', 'company', 'not', 'add', 'chemicals', 'lesson', 'learned contains', 'peg']",peg chemical banned eu product reason chemical company win cereve reputation check hoped company not add chemical lesson learned contains peg,0.8,positive
2,probably cleans well but it doesn’t lather at all. i use it in the shower and it feels like i’m just spreading lotion on my face as opposed to soap.ehh,CeraVe,"['cleans', 'lather', 'shower', 'feels', 'spreading', 'opposed', 'soap ehh']",clean lather shower feel spreading opposed soap ehh,0.3666666666666667,positive
2,"i had used both this product and the am moisturizer for years.  at some point cerave changed the formula for the moisturizer and i could no longer use it.  i think the formula for this may have changed as well because i have been experiencing eczema around my eyes on and off for a year.  i didn't use it for a few weeks as i dealt with healing my skin.  used it two days on a row and i'm beginning to see redness again...try before you buy.used it for years, but as of 2022..",CeraVe,"['changed', 'formula', 'formula', 'changed', 'experiencing', 'eczema', 'eyes', 'nt', 'weeks', 'dealt', 'healing', 'days', 'row', 'redness', 'buy used']",changed formula formula changed experiencing eczema eye nt week dealt healing day row redness buy used,0.0,neutral
2,i find makeup residue on my face.does not cleanse,CeraVe,"['residue', 'face does', 'not', 'cleanse']",residue face does not cleanse,0.0,neutral
2,"ok, lots of people love this cleaner, but i tried it for a couple days and i really don’t like it. 1.) it feels very oily to me when apply it in my face. i really dislike the feel of it on my skin, and 2.) my face doesn’t feel as clean and smooth when i use this vs just using any other type of facial cleanser. again, just my opinion, but i won’t be buying this again.feels oily when using",CeraVe,"['lots', 'love', 'cleaner', 'couple', 'days', 'feels', 'dislike', 'clean', 'smooth', 'type', 'opinion', 'buying', 'again feels']",lot love cleaner couple day feel dislike clean smooth type opinion buying again feels,0.4222222222222222,positive
2,"out of all the cerave products this is my least favorite one. it doesn’t create any foam at all so you have to use a lot for the product to cover your entire face, even when washing ur face in circular motion it is only layering up the surface and not really doing much for your face. also, the texture is weird, try for yourself and you’ll see. try the “makeup removing” one, that one is 10/10ehhh",CeraVe,"['products', 'favorite', 'create', 'cover', 'entire', 'washing', 'ur', 'circular', 'motion', 'layering', 'surface', 'not', 'weird', 'removing']",product favorite create cover entire washing ur circular motion layering surface not weird removing,0.25,positive
2,not a very good cleanser. make up was still there after washing with this cleanserit's not a great cleanser,CeraVe,"['not', 'washing', 'cleanserit', 'not']",not washing cleanserit not,0.0,neutral
2,feels like it does not get my face clean at all. have to use a lot of it and feels like i’m washing my face with just moisturizer.doesn't clean well,CeraVe,"['feels', 'not', 'clean', 'feels', 'washing', 'moisturizer does', 'nt', 'clean']",feel not clean feel washing moisturizer does nt clean,0.09166666666666667,positive
2,i thought i'd give this one a try since i tried the foaming face wash..i don't like this one going back to the foaming face wash. this one doesn't make my face clean at.don't feel cleaner,CeraVe,"['nt', 'nt', 'clean', 'at do', 'nt', 'cleaner']",nt nt clean at do nt cleaner,0.3666666666666667,positive
2,"okay, it’s says it’s  cerave but when i got it- it came without the sign and it smelled unusual. it didn’t smell like the one i usually have. guess i’ll see the resultsedit:im still not 100% sure this is a legitimate product but i know for a fact that it did work a little. over the weeks, i switched from the foaming cleanser to this cleanser day by day. i've noticed that sometimes when my blackheads start to fade away, and i put this on the next day, the blackheads would start to appear again. another flaw is that it didn't have the reserved sign at one of the sides of the product. it only said cerave when it was supposed to say cerave with an r on the top. yes, it helped my skin just the tiniest bit, i'm still not proud of this product since there are many flaws with it. this product only helped my skin get smoother, nothing else. i wouldn't even say smoother since it would dry my skin and after i put on moisterizer and it ""goes away"" then my skin would start to feel softer than before. i wouldn't recommend buying this product so if your debating on buying this, i wouldn't. you should check out a different brand that hyram recommends.no cover?",CeraVe,"['sign', 'smelled', 'unusual', 'guess', 'resultsedit', 'not', 'legitimate', 'weeks', 'switched', 'blackheads', 'start', 'fade', 'blackheads', 'start', 'flaw', 'nt', 'sign', 'supposed', 'helped', 'tiniest', 'not', 'flaws', 'helped', 'smoother', 'nt', 'smoother', 'moisterizer', 'start', 'softer', 'nt', 'recommend', 'buying', 'debating', 'buying', 'nt', 'check', 'hyram', 'recommends no', 'cover']",sign smelled unusual guess resultsedit not legitimate week switched blackhead start fade blackhead start flaw nt sign supposed helped tiniest not flaw helped smoother nt smoother moisterizer start softer nt recommend buying debating buying nt check hyram recommends no cover,0.2,positive
2,"this product doesn't work well.  after washing my face, it feels like i haven't washed it.  it feels oily to the touch like it hasn't been washed.not good",CeraVe,"['nt', 'washing', 'feels', 'nt', 'washed', 'feels', 'touch', 'nt', 'washed not']",nt washing feel nt washed feel touch nt washed not,0.0,neutral
2,wasn’t happy woth the purchasemade breakouts on my face,CeraVe,"['happy', 'woth', 'purchasemade', 'breakouts']",happy woth purchasemade breakout,0.8,positive
2,"i bought into the hype lol. i wanted to find a facial cleanser that was not only cheap but effective, but i got the opposite of effective. my skin was doing just fine before i started using this cleanser -- and it immediately broke me out into painful cystic acne i hadn't had since high school! i was so sad and upset cuz it took me years to get my skin into good condition and only a month for me to ruin it because of this cleanser.maybe it works for other people, but for me, it's a hard no. at least amazon sent me a refund so at least thats something.not for acne prone skin",CeraVe,"['hype', 'lol', 'not', 'cheap', 'effective', 'effective', 'fine', 'broke', 'painful', 'cystic', 'nt', 'school', 'sad', 'upset', 'cuz', 'condition', 'ruin', 'cleanser maybe', 'hard', 'amazon', 'refund', 'something not', 'prone']",hype lol not cheap effective effective fine broke painful cystic nt school sad upset cuz condition ruin cleanser maybe hard amazon refund something not prone,0.09062500000000001,positive
2,"the media could not be loaded.
                



 love this face wash my skin sooo smother🥳🥳🥳🥳🥳🥳🥳🥳🥳🥳best face wash for dry skin",CeraVe,"['media', 'not', 'loaded', 'love', 'sooo', 'smotherbest']",medium not loaded love sooo smotherbest,0.5,positive
2,"it does make my skin soft but i just don't feel like it actually cleanses my face well. after researching, there is not much of anything in this that does cleanse. it's almost like washing with their face lotion. i will also not repurchase due to not being cruelty free, leaping bunny certified.i always use milky cleansers due to having dry skin that actually work.it's ok",CeraVe,"['soft', 'nt', 'cleanses', 'researching', 'not', 'cleanse', 'washing', 'not', 'repurchase', 'not', 'cruelty', 'leaping', 'bunny', 'certified i', 'milky', 'cleansers', 'work it']",soft nt clean researching not cleanse washing not repurchase not cruelty leaping bunny certified i milky cleanser work it,0.23333333333333334,positive
2,very mild and creamy but it doesn't even take makeup off? i had to wash the makeup off after i used this? seriously? threw it away and went back to my other facial cleanser.this is a facial cleanser?,CeraVe,"['mild', 'creamy', 'nt', 'threw', 'cleanser this']",mild creamy nt threw cleanser this,0.3333333333333333,positive
2,love cerave but this is a lose for me. very hydrating but doesn’t take makeup off very well. prefer foaming cleanserhydration but not cleansing,CeraVe,"['love', 'lose', 'prefer', 'cleanserhydration', 'not', 'cleansing']",love lose prefer cleanserhydration not cleansing,0.5,positive
2,"i ordered this on accident. i usually use the foaming cerave. i figured i’d go ahead a try it since it was the same brand. it doesn’t seem to clean my makeup off. and it leaves an odd waxy feeling later on my skin after rinsing. i have tried it several times hoping for a different result, but i find myself having to wash my face after washing my face. i do not recommend this product. i loved the foaming face wash, but this one is a no.left a rubbery film",CeraVe,"['accident', 'figured', 'clean', 'leaves', 'odd', 'waxy', 'rinsing', 'times', 'hoping', 'result', 'washing', 'not', 'recommend', 'loved', 'no left', 'rubbery', 'film']",accident figured clean leaf odd waxy rinsing time hoping result washing not recommend loved no left rubbery film,0.225,positive
2,"i love and purchase various cerave products regularly. although i am a new fan of these amazing skin care products, i’m not sure of this particular purchase. this was so watered down it almost was like using water! i later purchased the foaming facial wash and.that item came exactly as i would expect! i’m going to compare to see if they were separate sellers and let amazon know. i hear sometimes sellers will water down or change their products to something than what the bottle states. that is horrible to do to a brand name. i’m not sure i will continue to buy my skin care, make up items or anything fluid which the product could be tampered with.nit sure this is a genuine cerave product",CeraVe,"['love', 'purchase', 'products', 'regularly', 'fan', 'amazing', 'products', 'not', 'purchase', 'watered', 'water', 'and that', 'item', 'expect', 'compare', 'separate', 'sellers', 'amazon', 'hear', 'sellers', 'water', 'change', 'products', 'horrible', 'not', 'continue', 'items', 'fluid', 'tampered', 'with nit', 'genuine']",love purchase product regularly fan amazing product not purchase watered water and that item expect compare separate seller amazon hear seller water change product horrible not continue item fluid tampered with nit genuine,0.08333333333333336,positive
2,honestly this product just doesn’t do it for me. when washing my face with this it doesn’t feel like i’m actually cleansing my face. really feels like i’m just smearing lotion on my face then getting it off and my skin has started to break out. i’ll try the foaming cleanser and hopefully that works.update: tried the walmart version of the foaming cleanser and i absolutely loved it it was only 3 dollars (equate foaming facial cleanser) instead of 12 for cerave and it’s amazing actually felt like it was cleaning and i’m assuming ceraves version is probably the same so definitely get that instead of this hydrating one. but if you can try the equate one as it’s a much better price and i even heard it’s better due to some ingredients.buy the foaming one!!!,CeraVe,"['washing', 'cleansing', 'feels', 'smearing', 'break', 'works update', 'walmart', 'version', 'absolutely', 'loved', 'dollars', 'equate', 'amazing', 'cleaning', 'assuming', 'ceraves', 'version', 'equate', 'heard', 'ingredients buy']",washing cleansing feel smearing break works update walmart version absolutely loved dollar equate amazing cleaning assuming ceraves version equate heard ingredients buy,0.65,positive
2,i didn't like this cleanser; i don't feel it's really cleaning my face; feels watery. i will not buy again.too watery,CeraVe,"['nt', 'nt', 'cleaning', 'feels', 'watery', 'not', 'again too', 'watery']",nt nt cleaning feel watery not again too watery,0.0,neutral
2,"so i just got this not long ago and have used it a handful of times. so far my skin is not loving it! the skin on my cheekbones is irritated and has started peeling. this stuff is supposed to be super gentle and moisturizing...but my skin doesn’t think so. it prefers the crappy st ives and biore i was using unfortunately. i am hoping that my skin just needs time to adjust, so i am going to keep using it sparingly and will update this if my skin gets better. fingers crossed since most people love this stuff!irritating my skin so far :(",CeraVe,"['not', 'handful', 'times', 'not', 'loving', 'cheekbones', 'irritated', 'peeling', 'supposed', 'super', 'gentle', 'prefers', 'crappy', 'ives', 'biore', 'hoping', 'adjust', 'sparingly', 'update', 'fingers', 'crossed', 'love', 'irritating']",not handful time not loving cheekbone irritated peeling supposed super gentle prefers crappy ives biore hoping adjust sparingly update finger crossed love irritating,0.06666666666666668,positive
2,"it was probably just bad for my skin, personally. i didn't like the feel of the product on my skin. i felt like i was washing my skin with lotion, which in turn, did not make my face feel clean at all.after a couple weeks of use, i started getting blackheads on my cheeks, which i've never had before in my 15 years of using fashwash.love the cerave brand, so i switched to the foaming wash, 10x's better!!!!love the brand, not this product, created blackheads for me",CeraVe,"['bad', 'personally', 'nt', 'washing', 'not', 'clean', 'all after', 'couple', 'weeks', 'blackheads', 'cheeks', 'fashwash love', 'switched', 'love', 'not', 'created', 'blackheads']",bad personally nt washing not clean all after couple week blackhead cheek fashwash love switched love not created blackhead,0.023333333333333362,positive
2,"i bought this product as a cleanser but it is not efficient in removing makeup. my sensation is cream with water. i dindt like it at all. if you have skin without makeup, it works for you but not to wash your skin with the intention of removing makeup.it is not makeup remover",CeraVe,"['not', 'efficient', 'removing', 'sensation', 'water', 'dindt', 'not', 'intention', 'removing', 'makeup it', 'not', 'remover']",not efficient removing sensation water dindt not intention removing makeup it not remover,0.0,neutral
2,i have been using this for a while and i have to use it with a silicone face scrubber or it does nothing. i wear make up some days and it wouldn’t take it off on it’s own. definitely have to wash twice with the silicone face scrubber to get it all off. it doesn’t dry my face out so i do think it is moisturizing. no scent which is nice. i won’t be buying it again because it doesn’t leave my face feeling clean.not impressed.,CeraVe,"['silicone', 'scrubber', 'days', 'silicone', 'scrubber', 'nice', 'buying', 'clean not', 'impressed']",silicone scrubber day silicone scrubber nice buying clean not impressed,0.15555555555555556,positive
2,"after reading all the great reviews, i was excited to get this.  i have literally bought and thrown away at least 4 different face soaps looking for the right one.  unfortunately, this one got a few uses and was in the trash (i just don't keep it, if i don't think i will use it).  i want something that will lather up and leave my skin feeling fresh and clean.  this felt more like was was trying to wash my face with hand lotion... no lather, and no squeaky clean feeling.  in fact after using it, i felt like i needed to use a different kind of soap to get wash this stuff off.  kinda bummed...doesn't lather",CeraVe,"['reading', 'reviews', 'excited', 'literally', 'thrown', 'soaps', 'trash', 'nt', 'nt', 'lather', 'fresh', 'clean', 'lather', 'squeaky', 'clean', 'soap', 'kinda', 'bummed', 'nt', 'lather']",reading review excited literally thrown soap trash nt nt lather fresh clean lather squeaky clean soap kinda bummed nt lather,0.35208333333333336,positive
2,"this ""wash"" feels exactly like putting hair conditioner on my face. it does not lather at all, and i don't feel like my face is clean at all when i'm done. sure, my face isn't as dry as it was (it works as intended), but i don't feel like my face is clean, either. i even tried using a scrubbing wash cloth with this wash (rather than my fingers as it recommends), but since there's no lather, it doesn't make any difference. i feel like this is just causing some kind of build-up over time on my face, making me use regular soap to wash it all off.warning -- no lather at all",CeraVe,"['feels', 'putting', 'hair', 'conditioner', 'not', 'lather', 'nt', 'clean', 'nt', 'intended', 'nt', 'clean', 'scrubbing', 'cloth', 'fingers', 'recommends', 'lather', 'nt', 'causing', 'buildup', 'regular', 'soap', 'off warning', 'lather']",feel putting hair conditioner not lather nt clean nt intended nt clean scrubbing cloth finger recommends lather nt causing buildup regular soap off warning lather,0.24444444444444446,positive
