Rating,Review,Brand,NoStopW Tokens,Lemmatized Tokens,TB Polarity Score,TB Sentiment
1,"i don’t understand how these brand name companies are still putting parabens in their products. so buy something else? well, as of the time that i am writing this review, the title of the face wash distinctly says paraben free. but the bottle clearly states methylparaben and propylparaben in the ingredient list. so i don’t like deceptive marketing.not paraben free",CeraVe,"['understand', 'companies', 'putting', 'parabens', 'products', 'writing', 'title', 'distinctly', 'paraben', 'methylparaben', 'propylparaben', 'list', 'deceptive', 'marketing not', 'paraben']",understand company putting parabens product writing title distinctly paraben methylparaben propylparaben list deceptive marketing not paraben,0.3,positive
1,bought this for my child to use as a face wash to help with small breakout in her t-zone area. it caused an allergic reaction all over her face. she had red irritated patches on her cheeks and jawline and clear lines of demarcation across her face. took her to the doctor to make sure it wasn’t a rash or infectious process of some sort to be extra cautious. after checking her over and then going over anything she was exposed to the doctor was pretty convinced it was the face wash as the culprit. she had to take some antihistamines and some anti inflammatory meds and put hydrocortisone cream on the patches for a few days and simply wash her face with warm water to let it rest and help it heal. i’m sure a lot of people use this product with no issue but i would strongly suggest a skin patch test for a couple of days before using on your entire face.caused reaction- proceed with caution.,CeraVe,"['child', 'breakout', 'tzone', 'caused', 'allergic', 'reaction', 'red', 'irritated', 'patches', 'cheeks', 'jawline', 'lines', 'demarcation', 'doctor', 'rash', 'infectious', 'process', 'sort', 'extra', 'cautious', 'checking', 'exposed', 'doctor', 'pretty', 'convinced', 'culprit', 'antihistamines', 'anti', 'inflammatory', 'meds', 'hydrocortisone', 'patches', 'days', 'simply', 'warm', 'water', 'rest', 'heal', 'patch', 'couple', 'days', 'entire', 'face caused', 'reaction', 'proceed', 'caution']",child breakout tzone caused allergic reaction red irritated patch cheek jawline line demarcation doctor rash infectious process sort extra cautious checking exposed doctor pretty convinced culprit antihistamine anti inflammatory med hydrocortisone patch day simply warm water rest heal patch couple day entire face caused reaction proceed caution,0.16999999999999998,positive
1,i’m highly against animal cruelty and if only this product was cruelty free then i’d probably like it but it’s not all that it’s hyped up to be tbh. not worth killing and torturing innocent animals that could most of f the time possibly be what we consider our pets. there constantly in pain for beauty and it’s not fair to themif only it was cruelty free,CeraVe,"['highly', 'animal', 'cruelty', 'cruelty', 'not', 'hyped', 'tbh', 'not', 'worth', 'killing', 'torturing', 'innocent', 'animals', 'pets', 'constantly', 'pain', 'beauty', 'not', 'fair', 'themif', 'cruelty']",highly animal cruelty cruelty not hyped tbh not worth killing torturing innocent animal pet constantly pain beauty not fair themif cruelty,0.03200000000000001,positive
1,"edit: lol i had a severe allergic reaction two years later, so who knows. i use cetaphil now and it’s been going well!i was recommended this by my sister who has fairly sensitive skin like me. i have eczema around my eyes that does not react well to certain products, so i did my research and read a lot of reviews. i found the most negatives tended to say that it didn't actually foam up, that it had a distinct, nasty smell, and that it dried their skin out.i am not positive which product those people may have received, because this cleanser was absolutely amazing! for those saying it didn't foam, my suggestion would be getting your hands wet, pumping one or two pumps, then rubbing your hands together before lathering it on your face. it foams up pretty fast, but not in an overpowering manner. i didn't notice any unusual scent, it just smelled like every other cleanser. i wouldn't say it dries out your skin, but it does leave it feeling very tight. i typically use pond's moisturizer after cleaning my face.overall, it is a wonderful product that gets the job done! very gentle for my sensitive skin!never going back!",CeraVe,"['edit', 'lol', 'severe', 'allergic', 'reaction', 'cetaphil', 'recommended', 'sister', 'eczema', 'eyes', 'not', 'react', 'products', 'read', 'reviews', 'negatives', 'tended', 'nt', 'distinct', 'nasty', 'dried', 'out i', 'not', 'positive', 'received', 'absolutely', 'amazing', 'nt', 'suggestion', 'hands', 'wet', 'pumping', 'pumps', 'rubbing', 'hands', 'lathering', 'foams', 'pretty', 'fast', 'not', 'overpowering', 'manner', 'nt', 'notice', 'unusual', 'smelled', 'nt', 'dries', 'tight', 'typically', 'pond', 'cleaning', 'face overall', 'wonderful', 'job', 'gentle']",edit lol severe allergic reaction cetaphil recommended sister eczema eye not react product read review negative tended nt distinct nasty dried out i not positive received absolutely amazing nt suggestion hand wet pumping pump rubbing hand lathering foam pretty fast not overpowering manner nt notice unusual smelled nt dry tight typically pond cleaning face overall wonderful job gentle,0.08379169849758085,positive
1,it doesn’t feel the same one i buy from targetdidn’t like it,CeraVe,['targetdidn'],targetdidn,0.0,neutral
1,i don't feel much cleaner or look so either. my skin feels just as clean as if i used warm water and wipes my face with my hands. it's probably doing something good but its really expensive considering other options.pricey,CeraVe,"['nt', 'cleaner', 'feels', 'clean', 'warm', 'water', 'wipes', 'hands', 'expensive', 'options pricey']",nt cleaner feel clean warm water wipe hand expensive options pricey,0.15555555555555556,positive
1,"i first purchased this product at ulta and it was amazing! i have a oily face and it helped so much when i first used it. decided to purchase from amazon and the one that was delivered had to have been different some how. first 1-2 weeks of using this one, and my face broke out like no tomorrow.. my face was soo oily within the next 2-3 hours, like more than normal. i had to have wipes and napkins on stand by… threw it away and went to get a new one from ulta, worked perfectly fine.oily! oily! oily!",CeraVe,"['ulta', 'amazing', 'helped', 'decided', 'purchase', 'amazon', 'delivered', 'weeks', 'broke', 'tomorrow', 'soo', 'hours', 'normal', 'wipes', 'napkins', 'stand', 'threw', 'ulta', 'perfectly', 'fine oily']",ulta amazing helped decided purchase amazon delivered week broke tomorrow soo hour normal wipe napkin stand threw ulta perfectly fine oily,0.3888888888888889,positive
1,no expire date mentioned. i feel something is not right with this bottle. it's different from what i used to buy at walmart.no expire date,CeraVe,"['expire', 'mentioned', 'not', 'walmart no', 'expire']",expire mentioned not walmart no expire,0.0,neutral
1,when it arrived it had leaked out. the whole bottle. a messdamaged,CeraVe,"['arrived', 'leaked', 'messdamaged']",arrived leaked messdamaged,0.0,neutral
1,not the best make my skin dryirritate my skin,CeraVe,"['not', 'dryirritate']",not dryirritate,0.0,neutral
1,"sadly, i really wanted to love this,if not, at least like.  it was not for me. i have combination skin and this made my skin really dry and flakey.  there’s zero scent to it. i prefer the facial cleansers that leave that minty fresh feeling on my face. anyways, it just wasn’t worth the price and i gave the rest away.  i tried using this product for 2-3 months.not a fan:(",CeraVe,"['sadly', 'love', 'not', 'not', 'combination', 'flakey', 'prefer', 'cleansers', 'minty', 'fresh', 'worth', 'rest', 'months not', 'fan']",sadly love not not combination flakey prefer cleanser minty fresh worth rest months not fan,0.3666666666666667,positive
1,"i have never had an issue with a facial cleanser before, but this product started making my skin super irritated and stung a lot after the first couple of uses. initially it was fine, but after not too long it burned every time i tried to use it and i noticed i started to have a lot more smaller acne and irritated red skin than usual. after i stopped using it my skin has gradually gone back to normal. i had heard good things so i was pretty disappointed, especially since the bottle is so huge and i used hardly any of it.burned and caused acne",CeraVe,"['super', 'irritated', 'stung', 'couple', 'initially', 'fine', 'not', 'burned', 'irritated', 'red', 'usual', 'stopped', 'gradually', 'normal', 'heard', 'pretty', 'disappointed', 'huge', 'it burned', 'caused']",super irritated stung couple initially fine not burned irritated red usual stopped gradually normal heard pretty disappointed huge it burned caused,0.06875,positive
1,i bought this product under the assumption that is turns into foam as do many products on the market do. also as it'd clearly stated foaming cleanser. it does not foam up at all..i would assume the product either isn't what it's advertised as or the product has been sitting stored for yearsis not foaming,CeraVe,"['assumption', 'products', 'market', 'stated', 'not', 'assume', 'nt', 'advertised', 'sitting', 'stored', 'yearsis', 'not']",assumption product market stated not assume nt advertised sitting stored yearsis not,0.0,neutral
1,"does not foam up as much as expected, does not rinse off as thoroughly as the cream to foam wash and this foaming cleanser for normal to oily skin leaves a film of some type on your skin. other cerave products are top tier, this one in my opinion is bottom shelf.the cream to foam for normal to dry skin is a 5 star product, much better than this cerave foaming facial cleanser | makeup remover and daily face wash for oily skin.love cerave products but not this foaming face cleanser! returned to amazon!",CeraVe,"['not', 'expected', 'not', 'rinse', 'normal', 'leaves', 'film', 'type', 'products', 'tier', 'opinion', 'shelf the', 'normal', 'star', 'remover', 'skin love', 'products', 'not', 'returned', 'amazon']",not expected not rinse normal leaf film type product tier opinion shelf the normal star remover skin love product not returned amazon,0.2125,positive
1,"this is my favorite face wash, however, this time i ordered it the formula doesn’t feel right. it seems watered down and not as thick as usual. after suspecting it was off i used my friends face wash that is the same kind and hers was thick like normal.formula seemed off",CeraVe,"['favorite', 'formula', 'watered', 'not', 'usual', 'suspecting', 'friends', 'normal formula']",favorite formula watered not usual suspecting friend normal formula,0.25833333333333336,positive
1,this is how it came put of the package. the top is not floating around in the bag anywhere. i don’t have the time to drive to the store to do refund junk so i’m going to pour all of this into my old bottle but will definitely make sure i don’t forget to buy this the next time i go to heb.top completely gone,CeraVe,"['package', 'not', 'floating', 'drive', 'store', 'refund', 'junk', 'pour', 'forget', 'heb top', 'completely']",package not floating drive store refund junk pour forget heb top completely,0.3,positive
1,i really wish i had never tried a new skincare regimen. i’ve ben using clean and clear all my life and i should just always stick with it. cereve made me breakout and even develop a burn. so frustrating! i wish i could just get a full refund for their stuff i purchased. their pretty pricy. augh…not a happy customer…sorry cereve.made me breakout badly!,CeraVe,"['regimen', 'ben', 'clean', 'life', 'stick', 'cereve', 'breakout', 'develop', 'burn', 'frustrating', 'refund', 'pretty', 'pricy', 'aughnot', 'happy', 'customersorry', 'cereve made', 'breakout', 'badly']",regimen ben clean life stick cereve breakout develop burn frustrating refund pretty pricy aughnot happy customersorry cereve made breakout badly,0.06333333333333335,positive
1,not suitable for sensitive-dry/normal skin typeit makes skin more dry and sensitive. not recommended for normal skin types too. i have normal to dry skin its made my skin more drynot suitable for dry / normal skin,CeraVe,"['not', 'suitable', 'sensitivedrynormal', 'typeit', 'not', 'recommended', 'normal', 'types', 'normal', 'drynot', 'suitable', 'normal']",not suitable sensitivedrynormal typeit not recommended normal type normal drynot suitable normal,0.145,positive
1,items came as damaged and liquid everywhereitem damage,CeraVe,"['items', 'damaged', 'liquid', 'everywhereitem', 'damage']",item damaged liquid everywhereitem damage,0.0,neutral
1,"it could be great if the pump wasn't broken so i could properly try it! as it stands now, there is slime all over the vanity and my sleeves are soaked from my intense efforts to open it. there is not much more frustrating than when i spend 20 minutes trying to open a defective bottle and finally realize it isn't just me!it might be wonderful",CeraVe,"['nt', 'broken', 'properly', 'stands', 'slime', 'vanity', 'sleeves', 'soaked', 'intense', 'efforts', 'not', 'frustrating', 'spend', 'minutes', 'defective', 'realize', 'nt', 'wonderful']",nt broken properly stand slime vanity sleeve soaked intense effort not frustrating spend minute defective realize nt wonderful,0.2,positive
1,product leaves a sticky film on skin. awfulawful,CeraVe,"['leaves', 'sticky', 'film', 'awfulawful']",leaf sticky film awfulawful,0.0,neutral
1,"i decided to try this cleanser based on the good reviews. i liked it at first, but within a few days i started getting whiteheads and tiny bumps all over my face. i already have mild to moderate acne so i don't need more. as soon as i switched back to philosophy purity, my acne improved overnight and within a few days all of my pimples were gone. this cleanser also made my face slightly drier than purity. it left a slippery film on my face which clogged my pores. one good thing is that it never made my face itch. i'm not saying this is a bad cleanser.  it has good ingredients. it might work for some people, but didn't work for me.leaves film and causes whiteheads",CeraVe,"['decided', 'based', 'reviews', 'days', 'whiteheads', 'tiny', 'bumps', 'mild', 'moderate', 'nt', 'switched', 'philosophy', 'purity', 'improved', 'overnight', 'days', 'pimples', 'drier', 'purity', 'left', 'slippery', 'film', 'clogged', 'pores', 'itch', 'not', 'bad', 'ingredients', 'nt', 'me leaves', 'film', 'whiteheads']",decided based review day whitehead tiny bump mild moderate nt switched philosophy purity improved overnight day pimple drier purity left slippery film clogged pore itch not bad ingredient nt me leaves film whitehead,0.13666666666666666,positive
1,"the bottle arrived firstly and sticky and possibly moldy. the inside of the box was also gross. shouldn’t there be a plastic safety wrapper or something? it’s gross and we don’t feel comfortable using it.product arrived dirty, sticky, and moldy.",CeraVe,"['arrived', 'firstly', 'sticky', 'moldy', 'gross', 'plastic', 'safety', 'wrapper', 'gross', 'comfortable', 'it product', 'arrived', 'dirty', 'sticky', 'moldy']",arrived firstly sticky moldy gross plastic safety wrapper gross comfortable it product arrived dirty sticky moldy,0.010000000000000009,positive
1,i was super excited to receive this product for my oily skin. i've never been known to have a lot of acne just a few pimples here and around my period time or when do a lot of outside activities. my main concern was just my oily skin. i've also never had sensitive skin.  i used this for about 2/3 days and just after the first use i started to break out and get a rash on my cheeks from simple using it once a day. this product also dried out my skin around the chin area and caused peeling. will never use this product againcaused breakout and rash on cheeks and peeling :(,CeraVe,"['super', 'excited', 'receive', 'pimples', 'period', 'activities', 'main', 'concern', 'days', 'break', 'rash', 'cheeks', 'simple', 'dried', 'chin', 'caused', 'peeling', 'againcaused', 'breakout', 'rash', 'cheeks', 'peeling']",super excited receive pimple period activity main concern day break rash cheek simple dried chin caused peeling againcaused breakout rash cheek peeling,0.13499999999999995,positive
1,this product has nothing to do with oily skins and it makes it worsenot for oily skin.,CeraVe,"['skins', 'worsenot']",skin worsenot,0.0,neutral
1,"do not buy, this product is overly drying and i have oily skin. i’ve been using this product for 3 days and honestly i should’ve stopped after day 1. my skin is dry, irritated and peeling. really disappointed because i thought this would’ve been a cost effective alternative to the bigger skin care brands i’ve been using. i definitely learned one thing, if it’s not broken don’t fix it. won’t be using this cleanser again.do not buy! overly drying - even on oily skin.",CeraVe,"['not', 'overly', 'days', 'stopped', 'irritated', 'peeling', 'disappointed', 'cost', 'effective', 'alternative', 'bigger', 'brands', 'learned', 'not', 'broken', 'again do', 'not', 'overly']",not overly day stopped irritated peeling disappointed cost effective alternative bigger brand learned not broken again do not overly,0.012499999999999997,positive
1,foe some reason this product burns my face.  when i contacted customer service about it they were less than helpful.burns.,CeraVe,"['foe', 'reason', 'burns', 'contacted', 'customer', 'service', 'helpful burns']",foe reason burn contacted customer service helpful burns,0.0,neutral
1,"i used this facial wash & i am apparently allergic  to this.  my face is broke out,i have large red bumps and my skin is peeling & sore.  so i'm now trying to figure out how to get a refund for this facial wash and the moisturizer.  sure it works great for somenot for me",CeraVe,"['allergic', 'broke', 'red', 'bumps', 'peeling', 'sore', 'figure', 'refund', 'somenot']",allergic broke red bump peeling sore figure refund somenot,0.0,neutral
1,i’ve never had completely clear skin but usually there’s only a blemish or two at a time. this product made my entire chin and jawline break out. i used it for over a full week in case it was “clearing out” my skinny and actually working. there was more acne every day and the day i stopped using it i stopped getting new acne. watch out if acne begins when you start using thiscan cause acne,CeraVe,"['completely', 'blemish', 'entire', 'chin', 'jawline', 'break', 'clearing', 'skinny', 'stopped', 'stopped', 'watch', 'start', 'thiscan']",completely blemish entire chin jawline break clearing skinny stopped stopped watch start thiscan,0.05,positive
1,"i order this product consistently because i love it but it came with a broken/missing top. luckily, i have a previous bottle running empty and could swap out the tops. however, i am disappointed that it came this way and i don’t want to have to deal with a return. additionally, this product takes forever to ship and receive.great product but came with a broken/missing pump",CeraVe,"['consistently', 'love', 'brokenmissing', 'luckily', 'previous', 'running', 'swap', 'tops', 'disappointed', 'deal', 'return', 'additionally', 'takes', 'ship', 'receive great', 'brokenmissing']",consistently love brokenmissing luckily previous running swap top disappointed deal return additionally take ship receive great brokenmissing,0.1766666666666667,positive
1,i was using cerave a bottle that i purchased from ulta and i love it it was perfect for my combo skin. when i finished that one i decided to order it from amazon since i was ordering stuff from there already. big mistake my face broke out immediately. i also purchased the moisturizer and it made it so bad that i now have scabs on my face.do not buy!,CeraVe,"['ulta', 'love', 'perfect', 'combo', 'finished', 'decided', 'amazon', 'mistake', 'broke', 'bad', 'scabs', 'face do', 'not']",ulta love perfect combo finished decided amazon mistake broke bad scab face do not,0.2666666666666667,positive
2,"for context, i have oily, acne prone skin. so the pros are even though it’s fragrance free, the smell is really nice. other pro is the product lasts a long time so if you buy this bottle and use one pump 2 times a day, expect for it to last like 5 months tops. other than that, i feel like this cleanser does not clean my skin very well. maybe it’s the moisturizing benefits from the cleanser, but i don’t feel fully clean like how i would with la roche posay cleanser. i also sense that i get oily faster through the day with this cleanser so it doesn’t control my oils well. i really wanted to love this cleanser since so many people love it, but it’s not my favorite. might buy in a few years but for now, i’ll stick with my la roche posay cleanser.feels smooth and last for a long time, but didn’t clean my face well.",CeraVe,"['context', 'prone', 'pros', 'nice', 'pro', 'lasts', 'times', 'expect', 'months', 'tops', 'not', 'clean', 'benefits', 'clean', 'roche', 'posay', 'sense', 'faster', 'oils', 'love', 'love', 'not', 'favorite', 'stick', 'roche', 'posay', 'cleanser feels', 'smooth', 'clean']",context prone pro nice pro last time expect month top not clean benefit clean roche posay sense faster oil love love not favorite stick roche posay cleanser feels smooth clean,0.27999999999999997,positive
2,this foaming cleanser left my face feeling dry. the reason i tried it was because the moisturizing cleanser didn't remove my makeup well enough. i need an in between product that will remove makeup residue and moisturize my skin.left my face feeling dry,CeraVe,"['left', 'reason', 'nt', 'remove', 'remove', 'residue', 'skin left']",left reason nt remove remove residue skin left,0.0,neutral
2,"very poorly packaged; it's very possible that i may have gotten a used product as the cap could be easily opened, and it had dirty stains. it also does not foam up at all, considering it is a foaming cleanser which i find weird. i don't even know if this product is safe to use to be honest, but i will have to wait and see if it is effective.poor packaging no foam",CeraVe,"['packaged', 'cap', 'easily', 'dirty', 'stains', 'not', 'weird', 'nt', 'safe', 'honest', 'wait', 'effective poor']",packaged cap easily dirty stain not weird nt safe honest wait effective poor,0.15833333333333335,positive
2,does not foam over well and cannot returnpoor lather,CeraVe,"['not', 'not', 'returnpoor', 'lather']",not not returnpoor lather,0.0,neutral
2,"i am one of the biggest supporters and users of almost all cerave products. i am currently using the hydrating cleanser, renewing lotion and eczema body wash. my 2 year old uses the baby wash and baby lotion from cerave.so far, this foaming facial cleanser is the only cerave product that i have a serious concern with. the 7th ingredient is 'propylene glycol' and it may sound like not a lot but think it this way - all the good stuff like hyaluronic acid & all ceramides are after propylene glycol. whatever good is going to come from the 'good' stuff will be mitigated by pg. propylene glycol is a know skin sensitiser and you can ready plenty about it on google or elsewhere. if you have sensitive skin or conditions like rosacea/eczema/psoriasis, this cleanser will sting your skin and /or cause a rash or acne in the very first week. if you have normal skin, it will eventually sensitive your skin and it will thereafter start reacting to pg. i just don't understand why a super awesome brand like cerave can't use something better like butylene glycol instead. i have written to them but they have not reacted. i seriously hope they can replace this ingredient with a safer ingredient as i really need a foaming facial cleanser and it kills me to use other brands.tread with caution - loaded with propylene glycol",CeraVe,"['biggest', 'supporters', 'users', 'products', 'renewing', 'eczema', 'baby', 'baby', 'cerave so', 'concern', 'propylene', 'glycol', 'sound', 'not', 'hyaluronic', 'acid', 'ceramides', 'propylene', 'glycol', 'mitigated', 'propylene', 'glycol', 'sensitiser', 'ready', 'plenty', 'google', 'conditions', 'rosaceaeczemapsoriasis', 'sting', 'rash', 'normal', 'eventually', 'start', 'reacting', 'nt', 'understand', 'super', 'awesome', 'nt', 'butylene', 'glycol', 'written', 'not', 'reacted', 'hope', 'replace', 'safer', 'kills', 'brands tread', 'caution', 'loaded', 'propylene', 'glycol']",biggest supporter user product renewing eczema baby baby cerave so concern propylene glycol sound not hyaluronic acid ceramides propylene glycol mitigated propylene glycol sensitiser ready plenty google condition rosaceaeczemapsoriasis sting rash normal eventually start reacting nt understand super awesome nt butylene glycol written not reacted hope replace safer kill brands tread caution loaded propylene glycol,0.4166666666666667,positive
2,"i use this in the shower or to take off my makeup, and its pretty good value, like, it will take a pretty long time to finish this bottle, but that's not so great if the product doesn't work for you. it feels so dry and itchy, kind of like when you put too much powder on top of your foundation, you know? does not moisturize at all. and i have relatively oily skin, so if you have normal or dry skin this is certainly not the product for you.cleanses, but *really* dries out my skin",CeraVe,"['shower', 'pretty', 'pretty', 'finish', 'not', 'nt', 'feels', 'itchy', 'powder', 'foundation', 'not', 'normal', 'not', 'you cleanses', 'dries']",shower pretty pretty finish not nt feel itchy powder foundation not normal not you cleanses dry,0.08958333333333333,positive
2,it gets too papa use only a small amountit’s good but gets soapy,CeraVe,"['papa', 'amountit', 'soapy']",papa amountit soapy,0.0,neutral
