Rating,Review,Brand,NoStopW Tokens,Lemmatized Tokens,TB Polarity Score,TB Sentiment
2,"i found that this moisturizer was quite prone to pilling, especially when layered over other products (e.g. vitamin c, niacinamide). a quick look did not see an improvement in shine reduction or pores after using an entire bottle. i will be switching back to the toleriane double repair, especially since you get 75ml for $19 (this one was $31 for 40ml!).does not play well with other skincare products",La Roche-Posay,"['prone', 'pilling', 'layered', 'products', 'e g', 'vitamin', 'niacinamide', 'quick', 'not', 'shine', 'reduction', 'pores', 'entire', 'switching', 'toleriane', 'double', 'repair', 'not', 'play', 'products']",prone pilling layered product e g vitamin niacinamide quick not shine reduction pore entire switching toleriane double repair not play product,0.1111111111111111,positive
2,"this is a good product but i wouldn’t get it from amazon, i ordered two and one box was already open and the lotion looked used… yuck.one of the boxes was already open?",La Roche-Posay,"['amazon', 'looked', 'yuck one', 'boxes']",amazon looked yuck one box,0.0,neutral
2,for the size and price i was expecting a lot out of this product. but it felt tingly on my skin and didn’t blur anything.let down,La Roche-Posay,"['size', 'expecting', 'tingly', 'blur', 'anything let']",size expecting tingly blur anything let,0.0,neutral
2,this does moisturize... but i don’t think it does anything else. i don’t look mattified. like it’s a light moisturizer. no frills. try cerave pm facial moisturizing lotion. half the cost and probably the same result.i don’t think it’s worth the cost,La Roche-Posay,"['mattified', 'light', 'frills', 'cost', 'result i', 'worth', 'cost']",mattified light frill cost result i worth cost,0.35,positive
2,"i have had oily skin all my life and i was looking for something to moisturize my skin in winter months. i like a nice light moisturizer that doesn't weigh down my face, sadly this wasn't it. it felt heavy on my face, and didn't really sink into my skin. it just sat on top of my face. it even made me break out the next day.it's not for me",La Roche-Posay,"['life', 'winter', 'months', 'nice', 'light', 'nt', 'weigh', 'sadly', 'nt', 'heavy', 'nt', 'sink', 'sat', 'break', 'day it', 'not']",life winter month nice light nt weigh sadly nt heavy nt sink sat break day it not,0.26666666666666666,positive
2,"i have oily skin, and this product does not mattify at all.  this a moisturizer.does not mattify",La Roche-Posay,"['not', 'mattify', 'moisturizer does', 'not', 'mattify']",not mattify moisturizer does not mattify,0.0,neutral
2,it makes my face feel matte however it does not give it the look. literally oil comes up within 20 minutes.doesn't keep oil away,La Roche-Posay,"['matte', 'not', 'literally', 'minutes does', 'nt']",matte not literally minutes does nt,0.0,neutral
2,"doesn't work for me, waste of money, i have very oily skin and i'm just as oily with or without this expensive face cream. i've used it under my makeup as a primer. smells good, goes on easy protects against the sun, that's about it.i've also tried murad oil-control mattifier spf and this product is better but still not worth the money. i used to love vichy mattifier with spf but that product has discontinued.please advice me if there's another similar product out there that is better.oil control? not so much",La Roche-Posay,"['nt', 'waste', 'money', 'expensive', 'primer', 'smells', 'easy', 'protects', 'it i', 'murad', 'oilcontrol', 'mattifier', 'not', 'worth', 'money', 'love', 'vichy', 'mattifier', 'discontinued please', 'advice', 'better oil', 'not']",nt waste money expensive primer smell easy protects it i murad oilcontrol mattifier not worth money love vichy mattifier discontinued please advice better oil not,0.09722222222222222,positive
2,this isn’t a great product. i feel like it went faster than any other face lotion i’ve ever used. it does not sit will under makeup. i still break out on my chin. i don’t feel moisturized. honestly i don’t think it does anything great.wouldn’t recommend,La Roche-Posay,"['faster', 'not', 'sit', 'break', 'chin', 'great wouldn', 'recommend']",faster not sit break chin great wouldn recommend,0.8,positive
2,"this is suppose to be for oily and sensitive skin, however it is not working on my skin. its been causing more acne than i had since i start using it. no return policy as well!not working for acne prone skins",La Roche-Posay,"['suppose', 'not', 'causing', 'start', 'return', 'policy', 'not', 'prone', 'skins']",suppose not causing start return policy not prone skin,0.0,neutral
2,"it worked great the first few times i used it. it kept my skin moisturized from within, nice and matte in the surface. after a few times (4x) using the product it stopped keeping my skin matte. very pricey, not happy with product.not worth the price",La Roche-Posay,"['times', 'nice', 'matte', 'surface', 'times', 'stopped', 'keeping', 'matte', 'pricey', 'not', 'happy', 'product not', 'worth']",time nice matte surface time stopped keeping matte pricey not happy product not worth,0.016666666666666653,positive
2,"i so wanted this to work, but it actually makes my skin more oily. it has a thick, silicone/greasy feel going on.not great",La Roche-Posay,"['siliconegreasy', 'on not']",siliconegreasy on not,0.0,neutral
2,i bought this because of the ingredients and had high hopes. but it didn't do much for me. the matte look didn't last very long at all. it felt nice going on but just didn't last and there was a little bit of skin irritation.not for my oily skin.,La Roche-Posay,"['ingredients', 'hopes', 'nt', 'matte', 'nt', 'nice', 'nt', 'irritation not']",ingredient hope nt matte nt nice nt irritation not,0.6,positive
2,"the product is good. best for oily skin. not greasy & mositurizes my skin very well. however, the tube is so small **warning*** so small. i bought it on mar 20th, and i finished in 3 weeks. are you kidding me? $30 for this tiny tube?you will finish this moisturizer in 3 weeks",La Roche-Posay,"['not', 'greasy', 'mositurizes', 'warning', 'mar', 'finished', 'weeks', 'kidding', 'tiny', 'finish', 'weeks']",not greasy mositurizes warning mar finished week kidding tiny finish week,0.0,neutral
2,i am getting acné... when i was using the effaclar duo it seem to control better the acné. i just wanted to try it but think is not for me.... think better effaclar duo for me.,La Roche-Posay,"['acn', 'effaclar', 'duo', 'acn', 'not', 'effaclar', 'duo']",acn effaclar duo acn not effaclar duo,0.0,neutral
2,doesn't make my face matte. still shiny. stopped using because it doesn't do anything to my face to make it less shiny.doesn't reduce shine on my face,La Roche-Posay,"['nt', 'matte', 'shiny', 'stopped', 'nt', 'shiny does', 'nt', 'shine']",nt matte shiny stopped nt shiny does nt shine,0.0,neutral
2,high quality product but caused breakouts so not a fan.two stars,La Roche-Posay,"['quality', 'caused', 'breakouts', 'not', 'fan two', 'stars']",quality caused breakout not fan two star,0.0,neutral
2,"ok, so i got a sample size tube of this a few days ago. i was really eager to try this since my skin has been craving some moisture yet i’m so combination that any little bit of lotion that goes on my skin turns me into a grease ball within an hour and winds up breaking me out. i will admit that i love the fragrance of this. it is light and unisex. it is a fresh scent and appealed to me instantly. however, i don’t know if the tube i received is a fake or not because this moisturizer makes me super greasy so fast and has caused white heads to pop up since using it. i’m so bummed. i really need to moisturize as i am now in my late thirties and want to keep my skin looking somewhat decent as i age but i truly can’t fund something that doesn’t oil me up and break me out. yet another disappointing attempt at staying moisturized.made me super oily",La Roche-Posay,"['sample', 'size', 'days', 'eager', 'craving', 'combination', 'grease', 'ball', 'hour', 'winds', 'breaking', 'admit', 'love', 'light', 'unisex', 'fresh', 'appealed', 'instantly', 'received', 'fake', 'not', 'super', 'greasy', 'fast', 'caused', 'heads', 'pop', 'bummed', 'late', 'thirties', 'decent', 'fund', 'break', 'disappointing', 'attempt', 'staying', 'moisturized made', 'super']",sample size day eager craving combination grease ball hour wind breaking admit love light unisex fresh appealed instantly received fake not super greasy fast caused head pop bummed late thirty decent fund break disappointing attempt staying moisturized made super,0.03030303030303031,positive
2,"i have really oily skin, and the 3 step effaclar system has done a great job at making my skin less oily and clearing out my skin. i was really excited to try this product, because i've heard great things about it from makeup artists, reviews, youtube videos, etc.that being said, i like the texture of the moisturizer, the feel of it and it's great as a primer. however, it made my skin a lot more oily! my makeup started smudging pretty fast. at the beginning i thought i just needed a little adjustment period so that my skin could adjust to using a moisturizer again, after i haven't for several months (yes my skin is that oily!), but it didn't seem to work. it took a week for the three step system to reset my oily skin to being normal again.i do have to say, that i think this just might be me personally and few others who have extremely oily skin. i live in a humid climate, so that contributes as well. comparing the level of oiliness before i used the moisturizer and after i started using it, it definitely made my skin more oily unfortunately.made my skin more oily!",La Roche-Posay,"['step', 'effaclar', 'job', 'clearing', 'excited', 'heard', 'artists', 'reviews', 'youtube', 'videos', 'etc that', 'primer', 'smudging', 'pretty', 'fast', 'adjustment', 'period', 'adjust', 'nt', 'months', 'nt', 'step', 'reset', 'normal', 'again i', 'personally', 'extremely', 'live', 'humid', 'climate', 'contributes', 'comparing', 'level', 'oiliness', 'unfortunately made']",step effaclar job clearing excited heard artist review youtube video etc that primer smudging pretty fast adjustment period adjust nt month nt step reset normal again i personally extremely live humid climate contributes comparing level oiliness unfortunately made,0.10189393939393938,positive
1,"this was wayyyy too strong for my sensitive skin, it burnt my skin and now my skin is red, dry and irritated. do not use if you have sensitive skin.too strong for sensitive skin",CeraVe,"['wayyyy', 'strong', 'burnt', 'red', 'irritated', 'not', 'skin too', 'strong']",wayyyy strong burnt red irritated not skin too strong,0.28888888888888886,positive
1,"been using every day for the last 6 months, unfortunately have not noticed even a slight difference in post acne marks or even skin tone, no change at allno change",CeraVe,"['months', 'not', 'slight', 'post', 'marks', 'tone', 'change', 'allno', 'change']",month not slight post mark tone change allno change,0.08333333333333333,positive
1,i’ve been using this product every day for 2 months now and see no difference.didn’t help me :/,CeraVe,"['months', 'difference didn']",month difference didn,0.0,neutral
1,used it once and pump stopped working!pump doesn’t work,CeraVe,['stopped'],stopped,0.0,neutral
1,"cerave retinol serum didn't work for me.  i used it as per instructions and my skin became dry and appeared to age in just three days use.  i went back to my regular alpha product and, thankfully, there was no lasting effect.  i do use cerave daily moisturizing lotion on body and face - no ill effects with that.  one star bc it goes on as described and is unscented.guess it's not for all skin types",CeraVe,"['nt', 'instructions', 'appeared', 'days', 'regular', 'alpha', 'thankfully', 'lasting', 'effects', 'star', 'bc', 'unscented guess', 'not', 'types']",nt instruction appeared day regular alpha thankfully lasting effect star bc unscented guess not type,0.0,neutral
1,my skin peeling off after 4day. scared the hell out of me!!make my face swelling for 3days,CeraVe,"['peeling', 'scared', 'swelling']",peeling scared swelling,0.0,neutral
1,just from one use of this product it discolored my medial cheeks. my skin is light brown and it made it white. its been a week and no signs of getting my melanin back.discolored,CeraVe,"['discolored', 'medial', 'cheeks', 'light', 'brown', 'signs', 'melanin', 'back discolored']",discolored medial cheek light brown sign melanin back discolored,0.2,positive
1,"used this in combination with with cerave retinol eye cream and i’m of south east asian decent. it does not work on our skin tone and cerave and cetaphil are just doctor made and doctor prescribed, so they all make profits. every single dermatologist i have been to in the last 18 years has always prescribed cerave or cetaphil. neither have been effective without prescription oral medication.it does not work, save your money!",CeraVe,"['combination', 'south', 'east', 'asian', 'decent', 'not', 'tone', 'cetaphil', 'doctor', 'doctor', 'prescribed', 'profits', 'single', 'prescribed', 'cetaphil', 'effective', 'prescription', 'oral', 'medication it', 'not', 'save', 'money']",combination south east asian decent not tone cetaphil doctor doctor prescribed profit single prescribed cetaphil effective prescription oral medication it not save money,0.1738095238095238,positive
1,i didn’t like the product at allnot good,CeraVe,['allnot'],allnot,0.0,neutral
1,the package i received was clearly opened prior to shipping and resealed. i don't trust it enough to use.already opened box,CeraVe,"['package', 'received', 'prior', 'shipping', 'resealed', 'nt', 'trust', 'use already']",package received prior shipping resealed nt trust use already,0.0,neutral
1,"dislike: nothing to like about this cream, i didn’t realized that my skin is sensitive enough that the retinol made my face stings. i stopped using it.  it took a few weeks to heal.retinol",CeraVe,"['dislike', 'realized', 'stings', 'stopped', 'weeks', 'heal retinol']",dislike realized sting stopped week heal retinol,0.0,neutral
1,"i had watched a youtube video, in which the ""so-called, knowledgeable person"", recommended this product to reduce the appearance of sun spots on the face and back of hands and arms............. be careful !!! i have never had any issues with sensitive skin, until i tried this product. unfortunately, i did not try it on a small spot before i jumped in. after using cerave reserfacing retinol for three days in a row, the spots became red, inflamed , sensitive to touch, and the skin started to flake-off like a bad sunburn....... i guess that i should be happy that i did not try it on my face..... i would not recommend this product.be carful !!!",CeraVe,"['watched', 'youtube', 'video', 'socalled', 'knowledgeable', 'person', 'recommended', 'appearance', 'spots', 'hands', 'arms', 'careful', 'issues', 'not', 'spot', 'jumped', 'reserfacing', 'days', 'row', 'spots', 'red', 'inflamed', 'touch', 'flakeoff', 'bad', 'sunburn', 'guess', 'happy', 'not', 'not', 'recommend', 'product be', 'carful']",watched youtube video socalled knowledgeable person recommended appearance spot hand arm careful issue not spot jumped reserfacing day row spot red inflamed touch flakeoff bad sunburn guess happy not not recommend product be carful,5.551115123125783e-17,positive
1,"i use the brand’s cleanser, although i prefer nut-oil-free products. since i instantly wash the cleanser off, and mix it with goat milk (more vitamins than cow milk) powder, i have had no issues.i wanted a retinol serum and decided to try this.  however, i just saw that this formula includes alcohol and isopropyl myristate. both are known to be harsh for sensitive skin. i have extremely sensitive skin … i’m glad i took a closer look at the ingredients. both are rash flare-up triggers for my skin.i am returning this",CeraVe,"['prefer', 'nutoilfree', 'products', 'instantly', 'mix', 'goat', 'milk', 'vitamins', 'cow', 'milk', 'powder', 'issues i', 'decided', 'formula', 'includes', 'alcohol', 'isopropyl', 'myristate', 'harsh', 'extremely', 'glad', 'closer', 'ingredients', 'rash', 'flareup', 'triggers', 'skin i', 'returning']",prefer nutoilfree product instantly mix goat milk vitamin cow milk powder issues i decided formula includes alcohol isopropyl myristate harsh extremely glad closer ingredient rash flareup trigger skin i returning,0.04166666666666666,positive
1,"item arrived with no seal, box open with contents sliding out. its a no from me👎🏼used and/or returned product",CeraVe,"['item', 'arrived', 'seal', 'contents', 'sliding', 'meused', 'andor', 'returned']",item arrived seal content sliding meused andor returned,0.0,neutral
1,i just open product & only got a few drops out.  the product itself i love but this time there was only a few drops in bottle 🤔almost empty,CeraVe,"['drops', 'love', 'drops']",drop love drop,0.5,positive
1,my 18 year old daughter used this product and received a chemical burn from it.not for sensitive skin,CeraVe,"['daughter', 'received', 'chemical', 'burn', 'it not']",daughter received chemical burn it not,0.0,neutral
1,while i’m aware that too much should not be used the product does not last long enough to work. a larger size would be great.amount is ridiculous,CeraVe,"['aware', 'not', 'not', 'larger', 'size', 'great amount', 'ridiculous']",aware not not larger size great amount ridiculous,0.1791666666666667,positive
1,i'm 28 and i usually have clear skin when it comes to acne. i just wanted to get rid of my acne scars from my teenage years and maybe help with my bumpy nose.i've got cystic acne all over the bottom half of my face now. like serious whiteheads. a bunch on my chin and my mouth area.this is the only change i've made with my routine so i know it's this product.never again.gave me acne.,CeraVe,"['rid', 'scars', 'teenage', 'bumpy', 'nose i', 'cystic', 'whiteheads', 'bunch', 'chin', 'mouth', 'area this', 'change', 'product never', 'again gave']",rid scar teenage bumpy nose i cystic whitehead bunch chin mouth area this change product never again gave,0.0,neutral
1,not sure if product authenticity.  label on bottle.  directions ingredients etc should be embossed on the product.  will never buy again.label pasted on bottle,CeraVe,"['not', 'authenticity', 'label', 'directions', 'ingredients', 'embossed', 'again label', 'pasted']",not authenticity label direction ingredient embossed again label pasted,0.0,neutral
1,"it's not as concentrated as i expect in a serum, more of a cream. i've been using several weeks now and see no resultsnot a serum",CeraVe,"['not', 'concentrated', 'expect', 'weeks', 'resultsnot']",not concentrated expect week resultsnot,0.0,neutral
1,"the media could not be loaded.
                



 it was openthe sizes are smaller than the orderthe backge was not completed it was open",CeraVe,"['media', 'not', 'loaded', 'openthe', 'sizes', 'orderthe', 'backge', 'not', 'completed']",medium not loaded openthe size orderthe backge not completed,0.0,neutral
1,"i am turning 70.  i don't break out.  i saw this was good to minimize pores, resurface skin and i had a couple small scars, so thought i would try.  and fyi tree of life retinol has worked better for me and was cheaper.  i think it's still sold on amazon.cons:made bumps on my face! -  not like acne, but just some itchy bumps.  my skin felt less smooth.small container for the money - i even got on sale, but it's very small.  you don't need much at all, so i guess it would go far...if it worked for me, but didn't.my experience - i didn't expect a lot, i didn't expect bumps",CeraVe,"['nt', 'break', 'minimize', 'pores', 'resurface', 'couple', 'scars', 'fyi', 'tree', 'life', 'cheaper', 'sold', 'amazon cons', 'bumps', 'not', 'itchy', 'bumps', 'smooth small', 'money', 'sale', 'nt', 'guess', 'didnt my', 'experience', 'nt', 'expect', 'nt', 'expect', 'bumps']",nt break minimize pore resurface couple scar fyi tree life cheaper sold amazon cons bump not itchy bump smooth small money sale nt guess didnt my experience nt expect nt expect bump,0.07500000000000001,positive
1,it is openedit’s opened,CeraVe,['openedit'],openedit,0.0,neutral
1,i used this for the first time last night and noticed today that parts of my skin are very red and irritated (almost like a burnt feel) i don’t normally have sensitive skin.most definitely do not recommend if you have sensitive skin,CeraVe,"['red', 'irritated', 'burnt', 'skin most', 'not', 'recommend']",red irritated burnt skin most not recommend,0.25,positive
1,"all the materials included seemed pretty decent, but it did absolutely nothing for my post-inflammatory erythema of a stubborn bost-blemish spot. on the contrary, the spot felt much more red and irritated instead of fading or recovering. i would not use it again.it did pretty much nothing but irritate my pie",CeraVe,"['materials', 'included', 'pretty', 'decent', 'absolutely', 'postinflammatory', 'erythema', 'stubborn', 'bostblemish', 'spot', 'contrary', 'spot', 'red', 'irritated', 'fading', 'recovering', 'not', 'again it', 'pretty', 'irritate', 'pie']",material included pretty decent absolutely postinflammatory erythema stubborn bostblemish spot contrary spot red irritated fading recovering not again it pretty irritate pie,0.17333333333333334,positive
1,"i feel played for spending that much only for it to burn and make my skin flake. made my face so red, irritated and hot i couldn't touch it at all. don't buy this if you have sensitive skin. i absolutely love cerave but i'm not happy with how this product worked for me because of my sensitive skin.don't buy if you have sensitive skin!",CeraVe,"['played', 'spending', 'burn', 'flake', 'red', 'irritated', 'hot', 'nt', 'touch', 'nt', 'absolutely', 'love', 'not', 'happy', 'skin do', 'nt']",played spending burn flake red irritated hot nt touch nt absolutely love not happy skin do nt,0.0875,positive
1,"different formula, different color and different texture. i don’t even think this is the real product.not the same as the one bouth at store!",CeraVe,"['formula', 'color', 'real', 'product not', 'bouth', 'store']",formula color real product not bouth store,0.2,positive
1,"the media could not be loaded.product was opened, and was visible that a little of the serum had been used",CeraVe,"['media', 'not', 'loaded product', 'visible']",medium not loaded product visible,0.0,neutral
1,i’ve used pretty strong products even though my face is sensitive but this completely burnt my face! i have a massive red warm patch over the entire life side of my face where i applied it for only 4 days! do not use if you have sensitive skin!irritated my sensitive skin,CeraVe,"['pretty', 'strong', 'products', 'completely', 'burnt', 'massive', 'red', 'warm', 'patch', 'entire', 'life', 'applied', 'days', 'not', 'irritated']",pretty strong product completely burnt massive red warm patch entire life applied day not irritated,0.1976190476190476,positive
1,would gladly write a review but the product sill not dispense from container!!will return and try a new bottle. what a disappointmentdoesn’t come out of container,CeraVe,"['gladly', 'write', 'sill', 'not', 'dispense', 'return', 'disappointmentdoesn']",gladly write sill not dispense return disappointmentdoesn,0.5,positive
1,put on my acne scars and it resulted in very dry and flakey spots on my face. was very distracting. would not recommend.made my skin flakey and dry,CeraVe,"['scars', 'flakey', 'spots', 'distracting', 'not', 'recommend made', 'flakey']",scar flakey spot distracting not recommend made flakey,0.0,neutral
1,this product is completely unusable. the pump does not pump. this was a waste of money.pump doesn't work,CeraVe,"['completely', 'unusable', 'not', 'waste', 'money pump', 'nt']",completely unusable not waste money pump nt,0.1,positive
2,"i appreciated the size of the container, the brand, and the consistency of the cream itself. it's not too thick or thin, it doesn't smell, and the applicator is easy to use. however, this product did dry out the areas of my face i used this on. i use cerave face wash daily and was hopeful this cream would just enhance the product, but unfortunately it did not work for my skin.dried my skin",CeraVe,"['appreciated', 'size', 'consistency', 'not', 'nt', 'applicator', 'easy', 'hopeful', 'enhance', 'not', 'skin dried']",appreciated size consistency not nt applicator easy hopeful enhance not skin dried,0.14444444444444443,positive
2,"i bought this product after i had a major breakout as a cheaper alternative to the expensive retinol i usually use on my face and neck. to be honest, i didn't use this product for very long; about a week. my doctor told me to stop using it because it was causing some skin damage and irritation and it was exacerbating a bacterial infection.doctor told me to stop using it.",CeraVe,"['major', 'breakout', 'cheaper', 'alternative', 'expensive', 'neck', 'honest', 'nt', 'doctor', 'told', 'causing', 'damage', 'irritation', 'exacerbating', 'bacterial', 'infection doctor', 'told']",major breakout cheaper alternative expensive neck honest nt doctor told causing damage irritation exacerbating bacterial infection doctor told,0.05416666666666666,positive
2,it burns when i apply this to my face and turns rednot good for sensitive skin,CeraVe,"['burns', 'rednot']",burn rednot,0.0,neutral
2,this is doing the opposite of what i asked for. i’m now dealing with more bumps around my mouth and patches of dry irritated skin on my face.causing irritation,CeraVe,"['dealing', 'bumps', 'mouth', 'patches', 'irritated', 'face causing', 'irritation']",dealing bump mouth patch irritated face causing irritation,0.0,neutral
