Rating,Review,Brand,NoStopW Tokens,Lemmatized Tokens,TB Polarity Score,TB Sentiment
1,"did not get the chance to use the shampoo and conditioner, upon opening the box all the liquid had spilled out, flip tops were opendamaged bottles",La Roche-Posay,"['not', 'chance', 'shampoo', 'conditioner', 'liquid', 'spilled', 'flip', 'tops', 'opendamaged', 'bottles']",not chance shampoo conditioner liquid spilled flip top opendamaged bottle,0.5,positive
1,"someone said i should sue, im not going to but this is unacceptable. i cant go into work or drive. i trusted you with my health and am very upset and in pain from the reaction i got using your product.severe hives",La Roche-Posay,"['sue', 'not', 'unacceptable', 'drive', 'trusted', 'health', 'upset', 'pain', 'reaction', 'product severe', 'hives']",sue not unacceptable drive trusted health upset pain reaction product severe hive,0.0,neutral
1,"update: i won't be purchasing this again since it is not cruelty-free.there's a little-know fact about hyaluronic acid that folks should be aware of; it amplifies actives like retintols and tretinoin and can cause more of a reaction than those actives should normally. so, this is a great moisturizer to use if you use a moisturizer in combination with any actives as it will not interact with them.sure hyaluronic acid is great if you're using it alone or without actives in that it can help to moisturize the skin, but it should be avoided when using anti-aging actives and exfoliants.great moisturizer because it contains no hyaluronic acid! but not cruelty-free.",La Roche-Posay,"['update', 'wo', 'nt', 'purchasing', 'not', 'crueltyfree there', 'littleknow', 'hyaluronic', 'acid', 'folks', 'aware', 'amplifies', 'actives', 'retintols', 'tretinoin', 'reaction', 'actives', 'combination', 'actives', 'not', 'interact', 'them sure', 'hyaluronic', 'acid', 'actives', 'avoided', 'antiaging', 'actives', 'exfoliants great', 'hyaluronic', 'acid', 'not', 'crueltyfree']",update wo nt purchasing not crueltyfree there littleknow hyaluronic acid folk aware amplifies active retintols tretinoin reaction active combination active not interact them sure hyaluronic acid active avoided antiaging active exfoliants great hyaluronic acid not crueltyfree,0.11041666666666666,positive
1,"if this bothers you, then skip.burns eyes",La Roche-Posay,"['bothers', 'skip burns', 'eyes']",bother skip burns eye,0.0,neutral
1,"i love their melt in milk sunscreen so decided to try this moisturizer. unfortunately, it consistently pills and makes my skin break out (not horribly but my skin rarely ever breaks out) in certain areas. i don't use any products except moisturizers and only used it after washing my face.pills and breaking out",La Roche-Posay,"['love', 'melt', 'milk', 'decided', 'consistently', 'pills', 'break', 'not', 'horribly', 'rarely', 'breaks', 'nt', 'products', 'washing', 'face pills', 'breaking']",love melt milk decided consistently pill break not horribly rarely break nt product washing face pills breaking,0.19999999999999998,positive
2,"i use the face wash that recommended using the moisturizer as well for the best results. i opted for the spf one to be better for my skin, but it makes me break out when i normally don't have any issues with acne since i'm 35. i thought about trying the regular moisturizer, but i think i'll go back to the belif one i was using previously. i spent way too many years dealing with acne to start fighting with that again! 🙃feels nice, but made my skin break out",La Roche-Posay,"['recommended', 'opted', 'break', 'nt', 'issues', 'regular', 'belif', 'spent', 'dealing', 'start', 'fighting', 'feels', 'nice', 'break']",recommended opted break nt issue regular belif spent dealing start fighting feel nice break,0.16666666666666666,positive
2,"i have a great skin routine with all medical grade products. night time- wash, tone, serums, retinol & now this moisturizer (replaced skinbetter trio) to top it off. same routine for over a year and once i switched to this moisturizer it clumps up on my skin and i can’t stand it. won’t buy againclunky",La Roche-Posay,"['medical', 'grade', 'products', 'tone', 'serums', 'replaced', 'skinbetter', 'trio', 'switched', 'clumps', 'stand', 'againclunky']",medical grade product tone serum replaced skinbetter trio switched clump stand againclunky,0.0,neutral
2,"the first time i used this product my skin felt amazing soft. but soon after that i noticed that i was having an allergic reaction. i have a rash on my face and my skin is flaky and dry now. unfortunately, my skin hates niacinamide. i really wanted to love this product.allergic reaction",La Roche-Posay,"['amazing', 'soft', 'allergic', 'reaction', 'rash', 'flaky', 'hates', 'niacinamide', 'love', 'product allergic', 'reaction']",amazing soft allergic reaction rash flaky hate niacinamide love product allergic reaction,0.1,positive
2,first time i got it i loved it but this one smells like gasoline. must have been a bad batch since other people said the same thing. i will try again but will be the last if it happens again.smells like gasoline,La Roche-Posay,"['loved', 'smells', 'gasoline', 'bad', 'batch', 'again smells', 'gasoline']",loved smell gasoline bad batch again smells gasoline,5.551115123125783e-17,positive
2,piles every time i go to apply cosmetic products. and my nevada high desert skin still has flaky area. since it’s relatively lower cost i can use on my body. done!!pilling!!,La Roche-Posay,"['piles', 'cosmetic', 'products', 'nevada', 'desert', 'flaky', 'cost', 'pilling']",pile cosmetic product nevada desert flaky cost pilling,0.0,neutral
2,i bought this to put on my face at night and in the morning before my make routine. problem is it burns my eyes. even if i try not to get it close to my eyes it stings. not sure if this is some kind of reaction to the ingredients? also it’s probably not a good night moisturizer for night use because of the spf. it says broad spectrum spf in light yellow letters. i wouldn’t have bought it if i saw this. not a fan of sun screens.3 out of 10,La Roche-Posay,"['burns', 'eyes', 'not', 'close', 'eyes', 'stings', 'not', 'reaction', 'ingredients', 'not', 'broad', 'spectrum', 'light', 'yellow', 'letters', 'not', 'fan', 'screens ']",burn eye not close eye sting not reaction ingredient not broad spectrum light yellow letter not fan screens ,0.12291666666666667,positive
2,at first i thought this was going to be ok but then after a few weeks my face started breaking out and i had a lot of zits. i also didn't feel like it moisturized all that well. my skin still felt dry. i can't recommend this.made my face break out!,La Roche-Posay,"['weeks', 'breaking', 'zits', 'nt', 'nt', 'recommend', 'this made', 'break']",week breaking zit nt nt recommend this made break,0.0,neutral
2,"i tried it to see if my skin settles, but everyday i am getting an irritiation on my skin. giving me a rash and itching on forehad or some other face parts. reviews said it works great on sensitive skin, however it didn't suit me unfortunately!giving me a rash and break out on face",La Roche-Posay,"['settles', 'irritiation', 'rash', 'itching', 'forehad', 'reviews', 'nt', 'suit', 'rash', 'break']",settle irritiation rash itching forehad review nt suit rash break,0.0,neutral
2,"i am on the fence about this cream, it doesn't seem to moisturize my skin and it burns when i put it onno scent",La Roche-Posay,"['fence', 'nt', 'burns', 'onno']",fence nt burn onno,0.0,neutral
2,"i have very dry patches of bumpy skin on my cheeks from keratosis pilaris. very few products work. i tried this and saw no improvement in the bumps. on the bright side, it does tend to pill and i used it to pill and exfoliate my face. i put the lotion on, let it set, then cleanse my face really well and then some dead skin comes off. hence why i give it 2 stars, not 1. it isn't perfumed and has a negligible medicinal scent. the tube doesn't last too long (less than a month for me with pretty minimal amounts used every evening) and seems expensive for how much product you really get. i think it's worth a try but doesn't work for kp sufferers. i had better luck with hydroboost by neutrogena or the gel moisturizer by clinique.didn't work for me",La Roche-Posay,"['patches', 'bumpy', 'cheeks', 'keratosis', 'pilaris', 'products', 'bumps', 'bright', 'tend', 'pill', 'pill', 'exfoliate', 'set', 'cleanse', 'dead', 'stars', 'not', 'nt', 'perfumed', 'negligible', 'medicinal', 'nt', 'pretty', 'minimal', 'amounts', 'evening', 'expensive', 'worth', 'nt', 'sufferers', 'luck', 'hydroboost', 'neutrogena', 'clinique did', 'nt']",patch bumpy cheek keratosis pilaris product bump bright tend pill pill exfoliate set cleanse dead star not nt perfumed negligible medicinal nt pretty minimal amount evening expensive worth nt sufferer luck hydroboost neutrogena clinique did nt,0.075,positive
2,it came used and open no sealed at all! i don’t know if someone returned it. threw it away!used!,La Roche-Posay,"['sealed', 'returned', 'threw']",sealed returned threw,0.0,neutral
2,it’s not bad because it feels good on my skin but it is not completely absorbed by my skin hours later i can feel and remove the cover of the cream like soft traces of the creami was expecting more of it,La Roche-Posay,"['not', 'bad', 'feels', 'not', 'completely', 'absorbed', 'hours', 'remove', 'cover', 'soft', 'traces', 'creami', 'expecting']",not bad feel not completely absorbed hour remove cover soft trace creami expecting,0.09999999999999998,positive
2,i was not a fan of this lotion it just doesn’t do the job.not great,La Roche-Posay,"['not', 'fan', 'job not']",not fan job not,0.0,neutral
2,"i couldn't order my usual moisturizer (shop was out of stock) and bought this, hoping.  it does not ""sink in.""  my skin felt sticky for a couple of hours, then it felt as if i hadn't used anything.  this was a waste of money and neither my daughter nor my granddaughter want to bother to try it.  moisturizer is one thing i won't buy on the cheap because my family has thin very fair skin.  if you have any skin issues, this isn't going to work.not a replacement for serious moisturiziing",La Roche-Posay,"['nt', 'usual', 'shop', 'stock', 'hoping', 'not', 'sink', 'sticky', 'couple', 'hours', 'nt', 'waste', 'money', 'daughter', 'granddaughter', 'bother', 'wo', 'nt', 'cheap', 'family', 'fair', 'issues', 'nt', 'work not', 'moisturiziing']",nt usual shop stock hoping not sink sticky couple hour nt waste money daughter granddaughter bother wo nt cheap family fair issue nt work not moisturiziing,0.16249999999999998,positive
2,"nice texture, but strong smells to chemicals/plasticsmells like chemicals",La Roche-Posay,"['nice', 'strong', 'smells', 'chemicalsplasticsmells', 'chemicals']",nice strong smell chemicalsplasticsmells chemical,0.5166666666666666,positive
2,"burned my eyes. i didn't get it in the eyes, just close to them and it caused eyes to sting.discomfort",La Roche-Posay,"['burned', 'eyes', 'nt', 'eyes', 'close', 'caused', 'eyes', 'sting discomfort']",burned eye nt eye close caused eye sting discomfort,0.0,neutral
2,"this item was just delivered 5 minutes ago and when i opened it, it looked like this….delivered opened",La Roche-Posay,"['item', 'delivered', 'minutes', 'looked', 'this delivered']",item delivered minute looked this delivered,0.0,neutral
2,"have it for almost 2.5 now of 1-time a day consistent use. still not close to finish!initially i thought it peeled off, however, turned out it was my face skin! i am using a retinoid on my face so my skin peels off like crazy, and i thought it was cream pieces. i decided tot test on my inner forearm and the cream stays on (and gets absorbed) perfectly on my forearm skin no matter how much i tried rubbing it to cross out the peeling off issue. yes, it is indeed a good cream. i amstill surprised that my generous use did not waste the whole pack.my skin stings though while on a strong retinoid when i use this cream. this is not entirely the cream’s problem but will remove one star for it, as vanicream doesn’t sting my skin. maybe they could make the ingredients slightly less irritating?peels off",La Roche-Posay,"[' ', 'consistent', 'not', 'close', 'finish', 'initially', 'peeled', 'retinoid', 'peels', 'crazy', 'pieces', 'decided', 'tot', 'forearm', 'stays', 'absorbed', 'perfectly', 'forearm', 'matter', 'rubbing', 'cross', 'peeling', 'amstill', 'surprised', 'generous', 'not', 'waste', 'pack my', 'stings', 'strong', 'retinoid', 'not', 'remove', 'star', 'vanicream', 'sting', 'ingredients', 'irritating', 'peels']",  consistent not close finish initially peeled retinoid peel crazy piece decided tot forearm stay absorbed perfectly forearm matter rubbing cross peeling amstill surprised generous not waste pack my sting strong retinoid not remove star vanicream sting ingredient irritating peel,0.11833333333333336,positive
2,leaves a flaky paste on your faceapplication,La Roche-Posay,"['leaves', 'flaky', 'paste', 'faceapplication']",leaf flaky paste faceapplication,0.0,neutral
2,"i was excited to try this product because i bought the face wash for it. the face wash was very useful and it worked! however, this face lotion was not suitable for my combination skin. after an hour of applying it, i noticed that my face was even more greasy than normal. the quality of this product is very good though.not for oily/combination skin",La Roche-Posay,"['excited', 'not', 'suitable', 'combination', 'hour', 'greasy', 'normal', 'quality', 'though not', 'oilycombination']",excited not suitable combination hour greasy normal quality though not oilycombination,0.08333333333333333,positive
2,i was surprised the product was not sealed.  suspicious that it was used.product was not sealed like most new items are!,La Roche-Posay,"['surprised', 'not', 'sealed', 'suspicious', 'used product', 'not', 'sealed', 'items']",surprised not sealed suspicious used product not sealed item,0.1,positive
2,this broke my skin out on my cheeks and foreheadbroke me out,La Roche-Posay,"['broke', 'cheeks', 'foreheadbroke']",broke cheek foreheadbroke,0.0,neutral
2,"i recently found out that i have rosacea, and after going through all these recommended products for rosacea, someone was raving about la roche-posay moisturizer. i was really excited to try this out since i found out 90% of my skincare products were just a big no for me now. well, let me tell you, other rosacea sufferers, that this moisturizer is just not for everyone. here's why.this moisturizer stings - yes, it stings! like, ouch! upon applying it on my face that was washed with a sensitive-skin friendly cleanser, i put a dab of this moisturizer on my face and could feel it starting to sting. then, the rosacea would appear brightly on my face. on top of that, my face felt extremely oily as if it was from this moisturizer. now, the moisturizer does say that it's oil-free; however, it really didn't feel like it.one plus thing about this moisturizer is that after applying it on my face, i didn't have any more of that itchiness. i do think it is doing its job as moisturizing, but it's also triggering my rosacea.also, if anyone is using the cetaphil sunblock along with this moisturizer, i do advise you to use it with care. i'll write a review for that sunblock, but these two do not mix well.not for all users with rosacea",La Roche-Posay,"['rosacea', 'recommended', 'products', 'rosacea', 'raving', 'rocheposay', 'excited', 'products', 'rosacea', 'sufferers', 'not', 'why this', 'stings', 'stings', 'ouch', 'washed', 'sensitiveskin', 'friendly', 'dab', 'starting', 'sting', 'rosacea', 'brightly', 'extremely', 'oilfree', 'nt', 'it one', 'nt', 'itchiness', 'job', 'triggering', 'rosacea also', 'cetaphil', 'sunblock', 'advise', 'write', 'sunblock', 'not', 'mix', 'well not', 'users', 'rosacea']",rosacea recommended product rosacea raving rocheposay excited product rosacea sufferer not why this sting sting ouch washed sensitiveskin friendly dab starting sting rosacea brightly extremely oilfree nt it one nt itchiness job triggering rosacea also cetaphil sunblock advise write sunblock not mix well not user rosacea,0.15625,positive
2,"as someone with sensitive skin who’s used this product for many years, i can vouch for this being an excellent and reliable moisturizer. a little goes a long way with this one, so the bottle should last you for a while. 5 stars for the product itself.that being said, i’m giving my amazon order 2 stars only because it arrived on time and was the correct product.i ordered this off of amazon as a gift for a friend, but the outside packaging was battered and torn. it actually looked like it had been opened. i had to return it because there’s no way i could gift something that arrived in terrible condition that could’ve been tampered with. my advise? ordering this on amazon is risky. you can always pick this up at your local cvs for about the same price.excellent product - poor delivery handling",La Roche-Posay,"['vouch', 'excellent', 'reliable', 'stars', 'itself that', 'amazon', 'stars', 'arrived', 'correct', 'product i', 'amazon', 'gift', 'friend', 'battered', 'torn', 'looked', 'return', 'gift', 'arrived', 'terrible', 'condition', 'tampered', 'advise', 'amazon', 'risky', 'pick', 'local', 'cvs', 'price excellent', 'poor', 'delivery', 'handling']",vouch excellent reliable star itself that amazon star arrived correct product i amazon gift friend battered torn looked return gift arrived terrible condition tampered advise amazon risky pick local cv price excellent poor delivery handling,0.12,positive
2,the package arrived exactly as shownpackage arrive opened,La Roche-Posay,"['package', 'arrived', 'shownpackage', 'arrive']",package arrived shownpackage arrive,0.0,neutral
2,i dislike it for a face cream. seems like it's more for sun protection.it is most of a sunscreen product than moisturizer.,La Roche-Posay,"['dislike', 'protection it']",dislike protection it,0.0,neutral
2,"the only reason i dislike this moisturizer so much is because of the rolling. like, if you move your fingers across your face or try to swipe on makeup, it looks like your skin's peeling off...i liked it initially because it goes on very light and seemed to absorb well. my skin felt moisturized, but anytime i put on makeup or rubbed my skin, it looked like i recently got a facial peel. i thought at first it was another product i was using, but after i stopped using the other product, my skin didn't stop looking like it was peeling after putting on moisturizer. over time i've realized that it's just the moisturizer rolling off, not my skin, and underneath it, my skin doesn't actually feel that moisturized after all (once the moisturizer rolls off). it appears to absorb very well, so it's hard to tell how much you've put on. if you put on very, very little, you won't have the peeling. but, you also won't have any moisturizing. it's a catch 22.pros: absolutely for sensitive skin - i had no problems with it actually peeling my skin or anything crazypeople seem to like this, so maybe it's just me, but it's an expensive moisturizer that just peels off and doesn't seem to do much.may be others' cup of tea, but not mine",La Roche-Posay,"['reason', 'dislike', 'rolling', 'fingers', 'swipe', 'peeling', 'initially', 'light', 'absorb', 'anytime', 'rubbed', 'looked', 'peel', 'stopped', 'nt', 'peeling', 'putting', 'realized', 'rolling', 'not', 'nt', 'rolls', 'appears', 'absorb', 'hard', 'wo', 'nt', 'peeling', 'wo', 'nt', 'catch', ' pros', 'absolutely', 'peeling', 'crazypeople', 'expensive', 'peels', 'nt', 'much may', 'cup', 'tea', 'not']",reason dislike rolling finger swipe peeling initially light absorb anytime rubbed looked peel stopped nt peeling putting realized rolling not nt roll appears absorb hard wo nt peeling wo nt catch  pros absolutely peeling crazypeople expensive peel nt much may cup tea not,0.0016666666666666718,positive
2,i switched from cerave to this and for some reason it burns my skin. the texture is amazing though. i can only guess what is causing this kind of reaction. perhaps the niacinimide? unfortunately i can’t use it :(burns my face,La Roche-Posay,"['switched', 'reason', 'burns', 'amazing', 'guess', 'causing', 'reaction', 'niacinimide', 'burns']",switched reason burn amazing guess causing reaction niacinimide burn,0.6000000000000001,positive
2,"ok, i have heard over and over this is an awesome moisturizer with spf, so i got it finally! i was excited to try it! it smells like sunscreen, not the coconut variety, but sunscreen nonetheless. it doesn’t feel luxurious and creamy, it feels like chalk as you try to smooth into the skin. i expected so much better, i will keep it just because summer is coming and i need a sunscreen but i will never buy again!wanted to love it but i hate it",La Roche-Posay,"['heard', 'awesome', 'excited', 'smells', 'not', 'coconut', 'variety', 'luxurious', 'creamy', 'feels', 'chalk', 'smooth', 'expected', 'summer', 'coming', 'love', 'hate']",heard awesome excited smell not coconut variety luxurious creamy feel chalk smooth expected summer coming love hate,0.22916666666666663,positive
2,"i loved this at first. the feel is great, texture is nice. but then i started waking up in the morning with oily skin (and i have very dry skin). after a few days my whole face was full of small ""under skin"" bumps. maybe it was an allergic reaction to something in this cream, even though it's for sensitive skin and that should not happen. 🤷🏼‍♀️love - hate",La Roche-Posay,"['loved', 'nice', 'waking', 'days', 'bumps', 'allergic', 'reaction', 'not', 'happen', 'love', 'hate']",loved nice waking day bump allergic reaction not happen love hate,0.24999999999999994,positive
2,"so i’ve been using this product for a full month now and i’ve got my honest review. i really wanted to like this product more than i do. i’ve heard such great things, however, this product just doesn’t feel moisturizing or hydrating on my skin at all. it has a thick consistency which may be due to the sunscreen in it but it feels heavy on my face and none soothing at all. moisturizing has always been my favorite part of my skincare routine but this stuff just doesn’t do it for me. my face has been breaking out which normally i’m not sensitive to either. overall, it’s okay and i like that there isn’t a scent. i’ll probably use the rest for neck and arms sunscreen. but i think i prefer my moisturizer and sunscreen to be applied separately.maybe get the one right sunscreen",La Roche-Posay,"['honest', 'heard', 'consistency', 'feels', 'heavy', 'soothing', 'favorite', 'breaking', 'not', 'rest', 'neck', 'arms', 'prefer', 'applied', 'separately maybe']",honest heard consistency feel heavy soothing favorite breaking not rest neck arm prefer applied separately maybe,0.3,positive
2,this moisturizer is good a doing it’s job moisturizing but my skin peels every time i put it on well it’s not even my skin it’s like white residue from the moisturize so i think if i even decide to use this anymore it will be at night or i might just discontinue completely i thought it was my sunscreen but it was this moisturizer all along peelingupdate,La Roche-Posay,"['job', 'peels', 'not', 'residue', 'decide', 'discontinue', 'completely', 'peelingupdate']",job peel not residue decide discontinue completely peelingupdate,0.1,positive
2,"update: this update is a few months late, but i did hear back from their customer service. they first told me to try the product without using any toner or oil underneath. then they said to go to  dermatologist and get my skin checked. apparently it’s a product that can only be used by people with perfect skin. i have pretty good skin, and i’ve never had this problem with any other moisturizer. what a shame. don’t buy this project.original review-i used to love la roche-posay. i’ve been using their cleansers for a long time. i wanted to give their moisturizer and their sunscreen a try, but i am very disappointed. like other reviews, this product causes a lot of pilling. i’m only able to use this on my face right now because of the quarantine i don’t go out much. don’t use this moisturizer with makeup. prior to writing this review i reached out to their customer service asking if it’s an old moisturizer or i should use a different product, but i got no response. i also got their melt-in sunscreen from cvs and that was also disappointing. super greasy and its definitely not meant to be used with makeup. unfortunately i can’t return it due to covid19 restrictions. i really wanted to love this brand, but i don’t think i’ll get their products anymore.i was a loyal customer, but i won’t be buying their products anymore. very disappointed.",La Roche-Posay,"['update', 'update', 'months', 'late', 'hear', 'customer', 'service', 'told', 'toner', 'checked', 'perfect', 'pretty', 'shame', 'project original', 'reviewi', 'love', 'rocheposay', 'cleansers', 'disappointed', 'reviews', 'pilling', 'quarantine', 'prior', 'writing', 'reached', 'customer', 'service', 'response', 'meltin', 'cvs', 'disappointing', 'super', 'greasy', 'not', 'meant', 'return', 'restrictions', 'love', 'products', 'anymore i', 'loyal', 'customer', 'buying', 'products', 'disappointed']",update update month late hear customer service told toner checked perfect pretty shame project original reviewi love rocheposay cleanser disappointed review pilling quarantine prior writing reached customer service response meltin cv disappointing super greasy not meant return restriction love product anymore i loyal customer buying product disappointed,0.07430555555555556,positive
